{
  "$schema": "../../schema/risk-overlays.schema.json",
  "schema_version": "0.1.0",
  "profile_id": "uk--jurisdiction-profile--0.1.0",
  "profile_version": "0.1.0",
  "risks": [
    {
      "risk_id": "EXPOSED-INFRASTRUCTURE-RISK",
      "statement": "Internet-reachable AI services or administrative paths can expand the opportunity for unauthorized access, exploit attempts, automated abuse, and resource exhaustion.",
      "circumstances": "The risk is in scope when an internet-originated connection can reach an AI service, supporting interface, or administrative path in the assessed boundary.",
      "source_basis": [
        "ESAF-1100 controls APP-150, API-110, INF-110, INF-120, INF-140, INF-150, and MON-110"
      ],
      "affected_controls": [
        "APP-150",
        "API-110",
        "INF-110",
        "INF-120",
        "INF-140",
        "INF-150",
        "MON-110"
      ],
      "overlay_ids": [
        "EXPOSED-BOUNDARY-OVERLAY"
      ]
    },
    {
      "risk_id": "PRIVILEGED-CONFIGURATION-RISK",
      "statement": "Unreconciled privileged access or configuration changes can bypass approved AI boundaries, alter protective settings, or prevent accountable reconstruction.",
      "circumstances": "The risk applies to every assessed boundary because administrative identities, configuration states, and material changes support operation even when their implementation is inherited.",
      "source_basis": [
        "ESAF-1100 controls IAM-120, IAM-130, IAM-150, INF-110, INF-130, and MON-150"
      ],
      "affected_controls": [
        "IAM-120",
        "IAM-130",
        "IAM-150",
        "INF-110",
        "INF-130",
        "MON-150"
      ],
      "overlay_ids": [
        "PRIVILEGED-CONFIGURATION-OVERLAY",
        "THIRD-PARTY-ADMINISTRATION-OVERLAY"
      ]
    },
    {
      "risk_id": "UNSUPPORTED-COMPONENT-RISK",
      "statement": "Unsupported or end-of-life components can retain unresolved defects, lose dependable maintenance paths, and frustrate safe recovery or replacement.",
      "circumstances": "The risk is in scope when component and support records identify any model, software, platform, protocol, or infrastructure element outside an approved support window.",
      "source_basis": [
        "ESAF-1100 controls MOD-150, INF-120, and ARC-150"
      ],
      "affected_controls": [
        "MOD-150",
        "INF-120",
        "ARC-150"
      ],
      "overlay_ids": [
        "SUPPORTED-COMPONENT-OVERLAY"
      ]
    },
    {
      "risk_id": "UNTRUSTED-SOFTWARE-RISK",
      "statement": "Models, application artifacts, or infrastructure dependencies from untrusted paths, and tools or plugins callable by an AI capability, can introduce malicious behavior, vulnerable dependencies, excessive authority, or unauthorized functionality.",
      "circumstances": "The risk is in scope when a defined untrusted model, application-artifact, or infrastructure-dependency intake path exists, or when the assessed AI capability can invoke a tool or plugin.",
      "source_basis": [
        "ESAF-1100 controls MOD-110, APP-140, API-120, and INF-120"
      ],
      "affected_controls": [
        "MOD-110",
        "APP-140",
        "API-120",
        "INF-120"
      ],
      "overlay_ids": [
        "TRUSTED-INTAKE-OVERLAY"
      ]
    },
    {
      "risk_id": "EXTERNAL-RESPONSIBILITY-RISK",
      "statement": "External services or administrators can leave control ownership, access authority, change duties, evidence access, continuity, and exit responsibilities incomplete or inconsistent.",
      "circumstances": "The risk is in scope when an external provider supplies a material service or when a third party can administer any component in the assessed boundary.",
      "source_basis": [
        "ESAF-1100 controls API-140, CMP-120, ARC-140, IAM-130, and IAM-150"
      ],
      "affected_controls": [
        "API-140",
        "CMP-120",
        "ARC-140",
        "IAM-130",
        "IAM-150"
      ],
      "overlay_ids": [
        "EXTERNAL-RESPONSIBILITY-OVERLAY",
        "THIRD-PARTY-ADMINISTRATION-OVERLAY"
      ]
    },
    {
      "risk_id": "INCOMPLETE-SCOPE-EVIDENCE-RISK",
      "statement": "Incomplete system, asset, dependency, or evidence coverage can omit material control responsibilities and make assessment conclusions unreliable for the declared boundary.",
      "circumstances": "The risk applies to every profile use because the package depends on a recorded system boundary, complete control population, resolved conditions, and traceable assessment evidence.",
      "source_basis": [
        "ESAF-1100 controls GOV-130, RSK-110, IAM-100, MOD-100, INF-100, AUD-120, and ARC-110",
        "ESAF-1500 evidence quality and assessment scope semantics"
      ],
      "affected_controls": [
        "GOV-130",
        "RSK-110",
        "IAM-100",
        "MOD-100",
        "INF-100",
        "AUD-120",
        "ARC-110"
      ],
      "overlay_ids": [
        "SCOPE-EVIDENCE-OVERLAY"
      ]
    }
  ],
  "overlays": [
    {
      "overlay_id": "EXPOSED-BOUNDARY-OVERLAY",
      "statement": "When internet exposure is present, the organization shall document every reachable service and administrative path, minimize permitted reachability, apply authenticated administration and risk-proportionate transport protection, test detection and response for representative abuse and exploit paths, and establish risk-proportionate capacity, quota, isolation, priority, budget, concurrency, scaling, and shutdown safeguards without fixed profile thresholds.",
      "applicability": "conditional",
      "activation_conditions": [
        "INTERNET-EXPOSURE"
      ],
      "affected_controls": [
        "APP-150",
        "API-110",
        "INF-110",
        "INF-120",
        "INF-140",
        "INF-150",
        "MON-110"
      ],
      "risk_ids": [
        "EXPOSED-INFRASTRUCTURE-RISK"
      ],
      "evidence_expectation_ids": [
        "BOUNDARY-EXPOSURE-EVIDENCE"
      ],
      "strengthening_rationale": "The overlay adds a current exposure inventory, tested boundary evidence, and service-specific resource safeguards while retaining each control's existing identity, protection, vulnerability, cryptography, capacity, abuse, and detection outcomes."
    },
    {
      "overlay_id": "PRIVILEGED-CONFIGURATION-OVERLAY",
      "statement": "The organization shall reconcile privileged identities, approved configuration baselines, material changes, and attributable audit events for the assessed boundary at a frequency justified by change and operational risk.",
      "applicability": "universal",
      "affected_controls": [
        "IAM-120",
        "IAM-130",
        "IAM-150",
        "INF-110",
        "INF-130",
        "MON-150"
      ],
      "risk_ids": [
        "PRIVILEGED-CONFIGURATION-RISK"
      ],
      "evidence_expectation_ids": [
        "PRIVILEGED-CONFIGURATION-EVIDENCE"
      ],
      "strengthening_rationale": "The overlay connects access, configuration, change, and audit evidence for one declared boundary without changing the authorization, hardening, review, or audit-trail meanings of the affected controls."
    },
    {
      "overlay_id": "SUPPORTED-COMPONENT-OVERLAY",
      "statement": "When an unsupported technology component is present, the organization shall identify its component type, apply the relevant model-retirement, infrastructure-vulnerability, or technology-lifecycle control, and record affected capabilities, exposure, available maintenance and compensating measures, accountable disposition, time-bounded replacement plan, and verification of completed action.",
      "applicability": "conditional",
      "activation_conditions": [
        "UNSUPPORTED-TECHNOLOGY-COMPONENT-PRESENCE"
      ],
      "affected_controls": [
        "MOD-150",
        "INF-120",
        "ARC-150"
      ],
      "risk_ids": [
        "UNSUPPORTED-COMPONENT-RISK"
      ],
      "evidence_expectation_ids": [
        "COMPONENT-SUPPORT-EVIDENCE"
      ],
      "strengthening_rationale": "The overlay makes support-state evidence and disposition timing explicit while preserving the existing vulnerability, retirement, decommissioning, and technology-lifecycle requirements."
    },
    {
      "overlay_id": "TRUSTED-INTAKE-OVERLAY",
      "statement": "For each activated model, application-artifact, callable-tool, or infrastructure-dependency path, the organization shall apply the relevant affected control by recording provenance and integrity for admitted artifacts, inspecting dependencies, inventorying and constraining callable tools and plugins, performing risk-proportionate testing, and blocking artifacts that do not meet approved acceptance criteria.",
      "applicability": "conditional",
      "activation_conditions": [
        "UNTRUSTED-MODEL-INTAKE",
        "UNTRUSTED-APPLICATION-ARTIFACT-INTAKE",
        "CALLABLE-TOOL-OR-PLUGIN-USE",
        "UNTRUSTED-INFRASTRUCTURE-DEPENDENCY-INTAKE"
      ],
      "affected_controls": [
        "MOD-110",
        "APP-140",
        "API-120",
        "INF-120"
      ],
      "risk_ids": [
        "UNTRUSTED-SOFTWARE-RISK"
      ],
      "evidence_expectation_ids": [
        "SOFTWARE-INTAKE-EVIDENCE"
      ],
      "strengthening_rationale": "The overlay binds each exact artifact or callable-tool fact to its relevant provenance, dependency, tool-governance, vulnerability, and acceptance evidence while preserving the affected supply-chain and assurance outcomes."
    },
    {
      "overlay_id": "EXTERNAL-RESPONSIBILITY-OVERLAY",
      "statement": "When an external provider is used, the organization shall maintain a service-specific responsibility record covering security, data handling, change, incident, continuity, evidence access, dependency concentration, and exit ownership, and shall verify the record against current architecture and service terms.",
      "applicability": "conditional",
      "activation_conditions": [